Review,Date
"Love the name that they decide to go with which makes it fun and funny. Overall, the quality of shop is very clean.

I was able to speak to the owner Veronica who is very nice and uplifting. The coffee is good and worth a try especially being a local business which I'm a big fan of. I got the Horchata frappe and it was a right amount of sweetness.","Mar 18, 2023"
Cafe de Ola with sweet cream on top was AMAZING!!! I will most definitely be going back!,"Oct 28, 2024"
"This place is such a great hidden gem , they accommodate with all the orders you want they can make them low sugar to high sugar which i appreciate it a lot, the tuna bagel was delicious and the place looks very clean too which helps when an establishment is serving food. I will be definitely coming back","Nov 9, 2024"
"Really wanted to like this place. I just moved up the street and it popped up on my TikTok so I was thinking ""What luck!"" A cute local coffee shop.
I was definitely disappointed. The space is very tiny, so not a lot of room to hang out there. It was also extremely warm.
The staff were friendly, but it took over 30 mins to get my drink. I figured they were just understaffed, but when I finally got my iced cafe de olla, it tasted extremely watered down. Like a cafe de olla lacroix. I almost tossed it if I hadn't waited a half an hour for it.","Sep 18, 2024"
Great customer service! The owner was so sweet and accommodating. The cafe de holla iced was good along with the crepe!,"Sep 21, 2024"
"Buen servicio muy amable la gente, la comida es una delicia, chisme potente buena energía","Mar 12, 2025"
"The coffee is just as delicious as ever, but having been away for a while, I'm a tad let down by their service hours. It's a shame they're not catering to the working morning crowd, their hours the first few months were a little weird. 9am Is simply to late","Aug 8, 2023"
"Okay. To start off the place is really cute and aesthetic, i ordered an everything bagel with cream cheese and it was a solid 9/10.

now, my suggestions begin with the abuelita blend i ordered, i'm not much of a sweet tooth but i expected to taste more of creamy chocolate that you normally taste when you drink chocolate abuelita, although it's a blend i tasted the ice more than anything else, 5/10.

I also ordered the red velvet cupcake, it was good but pretty average, i expected the icing to be creamy but it tasted like those cheap jelly like icing's that you can get at walmart for a dollar, 2/10 not worth the money.

Overall Coffee and chisme is cute and aesthetic but the quality in food can be a bit better.","Dec 15, 2024"
I used to love coming here but they don't advise when out of product they'll charge you then tell you after the fact when they're out of something. I had to get my money back they gave me my money from the tip jar and only gave me what the drink was worth. They didn't return the two extra dollars they charged me between the substitution of milk and tax. Really disappointed.,"Jan 13, 2025"
"Really wanted to give this place a try as their coffee looks flavorful; however, it was difficult to find parking and once I did, I walked over and no one said anything to me as I waited a some time standing over the cashier. I understand it may have been busy for them, but it would've been nice to hear something like ""we'll be right with you"". I ended up leaving, but would love to give this place another try, maybe at a less busy time. Place was a bit on the warm side so definitely seems better to go later towards the night.","Oct 7, 2024"
"The ladies here are always so nice. The place is very roomy and has a nice vibe to it as well. I came here a couple times with my mom, and she loved their cafe de olla! I did too. I highly recommend the banana nut loaf. My boyfriend took me here for our first date last year here as well. It's a good place to come to if you like to chat and sip!","Oct 30, 2024"
"They have so many food options that are all so good!! The ladies here are always so so sweet and attentive!!
It is a small place but the inside is so cute and the plants make it feel homey!! I will always recommend this place","Apr 22, 2024"
"This truly is a great place for coffee and chisme. My best friend and I spent well over an hour catching up, and we felt comfortable enough to do so. All of the staff was kind, especially Liz, whom I assume is the owner. She was very attentive and especially kind to my son. Gracias por su atención. Pronto regresamos!","Apr 19, 2024"
"Delish, nice people, perfect for the people to just want to have an aesthetic time to feel good","Oct 16, 2024"
"Me and my Tía went this morning to go have a little morning together. I got a lavender coffee and she got a matcha along with a croissant sandwich and I got a panini. I don't ever make reviews but this place was so good and did not disappoint. The service was really good and felt very welcoming and appreciative, I would definitely recommend this place. The ambiance is pretty and has a little couch where it feels super nice. Definitely a 10/10 !","Apr 12, 2024"
"Great place to meet up with friends and literally chismiar! They have a cool chisme jar, you can read through them and the tea was good, food and coffee is pretty.","Jan 31, 2025"
"My favorite place to get coffee!! The food options and the vibes are great too; the chisme jar is always entertaining and the staff makes you feel so welcome. I always get lots of work done here, but also love stopping by just to grab my coffee on a slow morning!","Oct 8, 2024"
"I found this location through instagram, my friend and I came here yesterday for some coffee and it was delicious. Very cute how they have it set up inside, wish there was more seating. The receptionist after placing our order offered us the chisme jar and 10/10. We definitely come back","Mar 2, 2025"
"Here on Memorial day and it was empty and slow when came in at 10:15am, its now 11:03 am and have not received all of my order. Drinks and food are not labeled, leaving me guessing on which is which.

Dont think ill come back, sorry to the girl working hard. While the ""manager"" was just sitting down not helping much.","May 27, 2024"
"I don't do reviews, but I really enjoyed this place. The service was great and I had an Americano with a coffee cake. Both were great! Inside is small but looks nice. I sat and ate my cake, even though I wasn't planning on staying.","Oct 1, 2024"
"I'm a coffee girl and love to check out oval coffee shops when in other cities. I came across this place and thought I'd give it a try because the name got me. I walked in and was told I couldn't be inside because I had my dog (mind you she's 3 pounds)
I get it, some establishments don't allow dogs but it's rare. Considering the place didn't appear to clean, I was offended. There was outside seating which is typical if they don't allow dogs but the area in which I was in, I didn't feel safe and seats looked uncomfortable (no back support)","Nov 20, 2023"
I liked coming here. The service was pretty nice. They are very friendly. Didn't try their food but i did try the coffee. It was a solid 7/10 i tried their lucky charms and Cocoa Puffs coffee. They are basically the same but different cereal. The ambiance felt very homey.,"Aug 16, 2024"
The service was great. Small but cozy ambiance to enjoy a hot or cold drink with good company.,"Jul 16, 2024"
"Loved the atmosphere of the place, they had so many different things on the menu you definitely have to go more than once to try everything out. The service was great it's bilingual and welcoming. I love the chiste of why it's called coffee and chisme","Feb 6, 2025"
my first time here and it was so good !! the service is very friendly and welcoming as well (: got the iced lavender london fog sooo good !!,"Feb 5, 2025"
"The food was absolutely delicious, i got the pesto chicken sandwhich and the caramel frappe. The food we ordered came quick and there is absolutely nothing wrong to say about it. Ordering was very easy and the whole setup of this cafe/restaurant was very nice! Loved it so much I will deff come again :)","Jul 26, 2024"
Amazing customer service Luz is amazing very friendly and super attentive. The ham and cheese is amazing I am so picky with my ham and cheese sandwiches but definitely pass the test thank you for you amazing food crepes very good as well. Drinks most definitely.,"Aug 27, 2024"
"Nice little spot they got some pastries and ice cream, I really like their caramel frappe","Aug 4, 2024"
"I came here because it had several good reviews and was excited to try a new coffee spot. Sadly, the service was not very good. We waited for over an hour to receive a two coffees, a panini, and a croissant. On top of that, they did not put out the orders in chronological order. They skipped over us and put out orders for at least three people who ordered much later than us. I will not be coming back here again, it felt like I had wasted a good portion of my morning.","Mar 16, 2024"
Amazing food and drinks ! The baristas are amazing and friendly! The place feels cozy and welcoming.,"Jul 31, 2024"
"Unlike some people, I don't show up to a business 10-15 minutes BEFORE they open and then complain about them not being open. ‍

Let me tell you how much I love this place -- the decor, the comfortable seating, THE SERVICE!! I love coming here for their iced chai lattes and delicious paninis. I have a feeling that in these colder months the Earl Grey London Fog is going to keep me warm~ The bagels and scones are delicious too!

Coffee & Chisme will definitely be a staple during my work days for sure.

If you haven't tried them out already, you definitely should!","Nov 8, 2022"
"Stop by this morning to get some breakfast since i like support my small businesses. Business was closed. Why post their hours if they aren't going to honor them . I will stop by my Starbucks since I know they're open.. I've been here a few times and there don't always have everything under menu available
***maybe consider updating the time on the door because if you zoom in It clearly l states 6 am . Maybe look at ur business hours on the door before you say it says 7 am.","Nov 3, 2022"
We got the cafe de olla with cold foam and the abuelita frappe and they were both super yummy. As someone who is a huge coffee lover I was impressed the iced coffee was not too sweet and had great flavor. I recommend the banana nut muffin it was delicious! The jar or chismes was entertaining to read while we waited for our order as well. I didn't catch the name of the lady who took our order but she was so friendly and welcoming!,"Nov 12, 2024"
"So many options!! The whole menu sounds amazing, i had tje cocopuffs drink with extra chocolate and its soooo perfect, the pricing is definitely reasonable for what you get, vegan pastries as well, i had the red velvet cupcakes and the frosting was perfectly fitying to the muffin, ill be coming back to try the rest of the menu","Dec 9, 2024"
I love this place specially since it's so close to where I live lol. It's a small little coge spot but they do have good drinks and pastries even some ice cream. The staff is awesome I Totally recommend!,"Aug 13, 2024"
"Excellent service, great food and awesome ambiance. I loved everything but in particular their employee Luz who is such a great host. She is charismatic, very attentive, and efficient. Food and drinks were quickly prepared. It was a very pleasant visit. Will definitely visit again and hope to see Luz. She is so loving and joyful.","Apr 20, 2024"
Really delicious coffee! It's located on a big street so you might have to park around the corner but my iced dirty chai with oat milk was amazing! It was pretty empty so I ordered right away and went on my way. The ladies who were working were super nice. There's a lot of food choices but I took one star off because my butter croissant wasn't flakey and nice like I like it. It was fine though.,"Jan 8, 2023"
"Great and fun coffee shop! Has a neighborhood feel but a lot of coffee options, pastries and more. I had the cafe de olla cold brew. It was tasty. Will be back for sure!","Oct 6, 2023"
Took almost half hour for 2 drinks wouldn't really recommend honesty was really disappointing the Cocoa Puffs drink taste like cereal with water,"Sep 15, 2024"
"Watered down drinks I ordered Oreo frapp, horchata frapp, and abuelita chocolate frapp they taste like water never again!!!!!","Sep 14, 2024"
"This place is super cute and all the people are so nice! I was so excited to hear about a new coffee shop opening in South Gate since I love mom and pop shops!

I came on their opening day and they seemed busy they were already out of some items so I'm glad it seemed to be going well.

I ordered an iced vanilla latte and an iced chai latte and accidentally got a hot chai but I am so glad because I really liked it! I also ordered a cheese danish and an everything bagel. They were both good.

This shop offers sandwiches and crepes too which I'm excited to try. Really cute shop! The only problem is street parking may be hard to find.","Oct 22, 2022"
"Skip the Starbucks and come to Coffee and Chisme! I personally love how sweet their cafecito is. I've always enjoyed their white chocolate mocha hot and I prefer it over Starbucks' because it tends to be more on the bitter side. The owners have always been very welcoming, and efficient. Out of the three times I've been here, I've never had an issue getting my food and drinks in a timely manner. The sausage and bacon muffin fills me up, comes out warm, and tastes like it was made from home. The bun is soft , as opposed to other breakfast sandwiches where the English muffin is hard, and the bacon and sausage taste on point. It's the perfect way to start your morning no matter what you're going to do today! I love the decor with the white neon sign entitled Coffee and Chisme. There's plenty of seats for you and your friend to chismeando or to get your study on! Come and support this Latinx small business .","Feb 24, 2024"
"Everything bagel was good. Cinnamon toast coffee was mid-- really sweet. Took over 30 minutes to get my order though. Would benefit from hiring more employees, there was only 1 girl behind the counter.","Mar 4, 2024"
"I love the cozy vibes, its a little hole in the wall near my house and the food is delicious, the crepes are yummy, the coffees are some of the best I've had and their paninis are my favorite. I like that you can customize your items, they really do cater to their customers. I rather go here than starbucks. Luz is literally the nicest person she makes you feel welcomed and has great customer service, all around great place 10/10 recommend!","Jul 3, 2024"
The food was not worth the price the girl made the crepe so lazily it was watery and was basically just a pancake and the sandwich was charred and just tasted burnt it's only good when the senora is there she is super nice and puts a lot of effort into it and got it to us fast the girl put no effort and took super long,"Sep 10, 2024"
Gotta say for my fist time coming to this coffee shop I was amazed not only by the great customer service but how good and authentic the abuelita ice latte tasted. I will be coming back. Support your local small businesses.,"Jul 22, 2024"
"We were highly recommended coffee and chisme from a close friend. Since we were in the area, we just had to go here.
Cute establishment and love the idea of the chisme jar. The menu had plenty of options and as I am not a coffee or much of a caffeine drinker, I was immediately drawn to the thrifties ice cream. Being as chocolate chip is my absolute favorite, I saw they had it and knew I had to get it.

Line was a bit long which was fine since coffee spots like this tend to draw long lines and the air was uncomfortably hot inside. When it was our turn to order, I went first and asked for a scoop of chocolate chip ice cream. The young girl behind the counter said cookies and cream? And I repeated myself and said chocolate chip. She looked me straight in the eyes and said we don't have that. It's either cookies and cream or full chocolate. I let her know that there was chocolate chip in the ice cream freezer and that the tub was labeled chocolate chip. And she said she knows but it's not chocolate chip. I was taken back because it just seemed like she wanted to prove her point instead of ask me questions like ""oh can you show me?"" So me being frustrated said nevermind I don't want anything and stepped aside to let the rest of my family order.
My husband saw what happened and knew I was bothered by this and offered to try to still get it for me. Sweet man. When he ordered it, he walked over to the freezer and pointed to the chocolate chip and was told by the young girl that it was pastachio. And when my husband said the one next to it was pastachio ( we could clearly tell it's pistachio icecream) he was ""corrected"" and said it was mint icecream. He figured since she confirmed chocolate chip was called pistachio in her eyes, he ordered the ""pistachio"". My family ordered two pistachios(not knowing the young girl was confused by the icecream flavors). When it was time for her to scoop out icecream, she scooped 3 chocolate chip icecream. My sister in law pointed out to her that it's supposed to be pistachio and the girl told her that's what it is. I walked up and pointed to the chocolate chip and said it's chocolate chip and the next one is pistachio. One of the other employees I think heard a bit of what was going on and kindly stepped in. He advised to her she was scooping the wrong ice cream and was able to finish helping us out with the correct order.
So after a 20 minute wait, no apologies and terrible manners by the young lady who ran the cashier, this left a bad taste in our mouths. After the rest of my family tried their coffees, they were disappointed as well. 2/10 would not recommend. (The 2 is for the chisme jar idea)","Aug 25, 2024"
Order the spicy chicken chipotle panini and the ice cinnamon latte and thank me later . Service was also amazing 10/10,"Apr 11, 2024"
My husband and I came a week or so ago and absolutely loved it. There is so much I can say about this place and how amazing we were treated. The staff was truly incredible and our experience there was like no other. It's a cute little spot but it also has great personality. We hope to stop by soon! I also LOVE that it very pet friendly!! Thank you Luz for the experience!,"Sep 30, 2024"
"New coffee shop in South Gate. Beautiful and clean shop with very welcoming team. Got an iced dirty chai.

Lots of nondairy alternatives and a large coffee menu. Look forward to coming back.","Nov 6, 2022"
Customer service was great! The woman who took my order was so sweet. The iced vanilla latte along with the vegan brownie I ordered was so good!,"May 23, 2024"
"Service and ambiance is great. It's a little nook with a warm feel. We tried the hazelnut waffle & crepe, which were delicious except that next time I visit I'll order the hazelnut spread on the side.","Feb 28, 2024"
Support local business this coffee shop is a must try. Best iced coffee is better than Starbucks. Service is 10/10 very welcoming and polite,"Apr 10, 2024"
"I love this place,today was my first time going,coffee is so good!!!! The chicken panini is so fire I loved it! The workers are so nice. Service was amazing!","May 17, 2024"
It is great place to get coffee every morning. Really good toast and yummy coffee. Employees are very kind!!,"May 16, 2024"
"Coffee & Chisme is the place to go for your Coffee and Chime needs! They are the BOMDIGGITY on the edge of Southgate. We had 4 strikeouts in coffee shops NOT selling Esperesso. The shop is CLEAN, the employees are SWEET and COURTEOUS.. The restroom is SPECTACULARLY clean! I HIGHLY recommend this for your MexiCali experience.","Jun 11, 2024"
Today was my first visit to this adorable coffee shop!!! I fully recommend going I purchased the lavender latte which was so good and the employees are so friendly. Wonderful place to study while enjoying a worm cup of coffee and the menu is catered to everyone from vegan to your sweet tooth.,"Mar 30, 2024"
I tried the cinnamon toast crunch iced coffee and it was good. The banana muffin was very flavorful . The chocolate croissant had a dark chocolate taste. The cafe the la olla iced coffee was great too. The ambiance was relaxing and clean. I love the decor. The service was as any other coffee shop.,"May 7, 2024"
I have been here twice and it is a little difficult to find parking since it is on a busy street but worth it! Their coffee is really good and the employees are really nice! It is a little hot inside but overall very nicely decorated and clean :),"Oct 27, 2024"
I loved the iced cafe de olla! Everyone was super friendly and quick with make our drinks.,"Sep 8, 2024"
Service is great and the food as well. Very cozy place and the ambience is just right. Need a bigger place but it's great. Chisme is also good lol,"Oct 15, 2024"
This is such a cute coffee shop. The seating is very limited but it is a great place to study and the coffee and treats I've tried so far are very good. There are outlets and wifi. They are busy but it is worth the wait.,"Apr 4, 2024"
"This is an adorable, cozy, and delish place... if searching for a refreshing drink try the lavender lemonade and the mojito mint lemonade...

If you are reminiscing on traditional abuelita try the chocolate abuelita latte ....will hit the spot

The service is great and friendly... you will enjoy the tranquility of the place...!","Apr 3, 2024"
"Great tasting coffee! We decided to try Coffee and Chisme out as it was a new spot very local to us.

The menu options are plentiful and the quality was great.

Their vanilla latte was on point. It had a nice balance of flavor and sweetness.

We will definitely be coming back to try out their crepes and waffles!","Dec 26, 2022"
"The barista was so nice, the cafe had a comfortable space for it being on the small side. I ordered the iced cafe latte and honestly the beans tasted burnt. My girlfriend had the coco puff iced coffee, if you order that wait a little bit for the cereal to really incorporate into the coffee","Jul 5, 2023"
I came to visit this quaint little shop over the weekend while visiting family. I was pleasantly surprised at this cute little shop. The ambiance was what you'd expect from going to a coffee shop on Abott Kinney in Santa Monica. The food and coffee was great as well. I ordered the strawberries and cream crepe and the cafe de olla. Love to support small businesses and this one made me happy to support knowing it is such an outstanding place in the middle of the hometown I grew up in. Definitely coming back next time I visit.,"May 24, 2023"
"I got an iced cafe de olla with oatmilk.
It tasted funky...like idk trapo sucio after taste.
The place was cute.
Parking sucked.
The lady was nice.
Will I come back? No.","Feb 25, 2023"
We got the chicken pesto panini and the mozzarella tomato basil panini. Both were really good and my friend enjoyed their coffee! We ordered pick up and they waited to make the drink so it'd be warm. But was still ready really fast,"Jul 9, 2024"
such a cute shop! the owner is so sweet as well. had the caramel frappe and it was delicious! only downside is parking but other than that its a neat place to visit with friends!,"Aug 16, 2024"
Came to this little spot had the best drink- dirty chai with oat milk and lavender it was so good. Ordered a tomato mozzarella pesto panini again so good!! Would definitely recommend this place. The service was excellent very friendly,"May 29, 2024"
"my sister ordered the crepe and chocolate abuelita and said both were delish i only tried the crepe and i can attest to it being very good !!
i ordered a ham and cheese croissant and a caramel macchiato and they were both so yummy. the croissant had both yellow and white cheese and the menu is not expensive at all in comparison to most breakfast cafes !","Jan 4, 2023"
I love this place! The workers are always so welcoming and so nice. Their white chocolate mocha is 10/10,"Aug 2, 2024"
First time here and truly enjoyed everything! I had a small iced latte and wished I had ordered a large one & the hubby got the cinnamon toast iced latte and he said it was the perfect amount of sweetness. We also tried the paninis and a plain crepe and they were just so delicious! Forgot to takes pics since we were so hungry ... till next time. Ps great service :),"Feb 2, 2023"
Not sure what espresso beans they use but the flavor is smooth. The vanilla syrup is not too sweet either. I ordered a small iced vanilla latte and it was really good. I'll be back to try a cafe de olla.,"Oct 24, 2022"
"This place is wonderful! The staff is so nice and attentive. Super cute atmosphere. They had so many drink options that my friend and I each ordered two! We had the hibiscus tea, cucumber lemonade, raspberry lemonade, and an abuelita cold brew. Each drink was amazing! I also ordered the turkey sandwich and it was delicious and perfectly toasted. The noise level is also enough for you to hear the person you're talking to but also loud enough that no one will listen to your conversation. Perfect for the chisme. We sat talking for two hours. 10/10 will come again","Jul 15, 2024"
The coffee is great! I have a picky boyfriend when it comes down to taste and he prefers the frappes better than Starbucks haha,"Nov 7, 2023"
Super cute spot ! Had the Cinnamon Toast Crunch Iced Coffee and I was not expecting actual Cinnamon Toast Crunch in my iced coffee super good ! Service is great!,"Oct 24, 2022"
