Review,Date
I was in the area and decided to try a new coffee place and I came in yesterday however I did not have the best experience. The young girl was taking my order and I witnessed another lady screaming at her in the middle of my order which made me uncomfortable. Not only that but i got my order about 30 minutes after ordering even though it was only 2 drinks.,"Jul 31, 2024"
"I ordered the cafe de olla iced and it was delicious. The menu has so many options for drinks and food, I can't wait to go back and try something else. The two women working here when I stopped by were very friendly. One of the women was taking a picture of a drink to post on social media and after taking their pictures they gave it to us for free to try it. I believe the drink was an iced strawberry matcha, It wasn't something I would have normally ordered but it was surprisingly delicious and very nice of them to do.","Mar 30, 2023"
one of my favorite places in all of Los Angeles to get coffee. Doesn't hurt that it's close to my parent's place either.,"Nov 15, 2023"
"No good at all, is that a crepe ? We want to support local businesses but....no goodddd !!!!!","Mar 20, 2023"
Great food and the service was fast. It is a small hole in the wall and the ambience is peaceful and welcoming. Definitely recommend their red velvet cupcake. Definitely be returning.,"Jun 14, 2024"
"10/10 recommend this cute coffee shop is so good I got a pizza panini, tomato mozzarella panini and two drinks which was a cold brew & a caramel macchiato all of them were so good Ill be coming back for sure. The service was excellent she was very helpful! Thanks Veronica :)","Dec 1, 2022"
"i waited 45 mins for my coffee, just to realize they hadn't even started my order. when I finally got my coffee it was cold, it didn't have any creamer or sugar (how I ordered) and the whole time 3 employees were in the back just chatting. this place was really a let down.","Feb 10, 2024"
"First timer at coffee&chisme, and I loved it! customer service , ambiance and coffee was great. I will definitely be returning. Also a big thank you to owner for being so welcoming and giving my son extra snacks","Mar 23, 2024"
"First time trying and found their iced cafe de olla with oat milk to be delicious especially since it's been hot! I tried the tomato, mozzarella with turkey panini amazing. Second time in a couple of days and I ordered same coffee but this time went with pastries but they were a bit dry for my liking (coffee cake which owner said was popular and blueberry scone which was average). Next time I will try something else!","Jul 21, 2023"
"Disappointed and i didnt even try the coffee! Their hours state they are open M-F from 9-8pm. We went around 4pm and it was closed! Not to mention, parking is extremely limited so we struggled to park just for us to go to a different spot!","Sep 23, 2023"
Came here to try out the coffee and food. They were sweet ladies behind the counter however they failed to warn us that they were extremely backed up. It took over an hour for us to get our order. I think it's unfair to let people order without a proper warning. On top of that people who arrived after us got their food and drink before us. It seemed that whoever went up there to complain got their food/drink faster. We were trying not to be rude but after an hour it was frustrating to not even get our simple coffee orders. We finally got our order after an hour and half.,"Mar 16, 2024"
"So far I have tried the iced cafe de olla and the cold brew, definitely recommend both if you like cold coffee.","Apr 22, 2024"
"An absolute gem! Incredible coffee, sweet atmosphere, and the friendliest staff you'll ever meet. A must-visit! Spicy chicken Panini, Jalapeño bagel and cream cheese delicious!","Apr 15, 2024"
"Cute place. Was really hot when I walked in. Maybe the AC was broken. Got an iced cafe de olla, pretty good! Got a pastry as well. Nice staff.","Jul 8, 2023"
This place has really great hospitality and customer service from the ladies at front .. definitely coming back.,"Mar 30, 2024"
"I order a turkey sandwich and a horchata frappe. All I said was no red onion and no bell pepper on my sandwich. I waited more than 15 minutes and the people that came after me got their orders before me. Once I got my sandwich I left without checking because I was almost late to my appointment. When I opened my sandwich I get is a turkey and cheese bagel. I checked my receipt to see if I had order correctly and I did. If all I was ""getting"" was a turkey and cheese sandwich why did it take more than 15 minutes for it.","Apr 29, 2023"
Nice little location. Luz helped me and she was very welcoming and sweet. Ordered the Nutella tropical crepe and an iced cafe de olla with cold foam. Both very delicious! Will be coming back,"Mar 18, 2024"
"The vibes are there, clean, friendly, street parking, nice decor, drinks are always full of flavor and made right, service ten out of ten","Jan 6, 2024"
"so disappointed. it was such a cute shop and concept but the coffee tastes like sink water and no coffee taste. i got a coco puff iced latte and i was expecting the ""coffee"" itself to have some sort of coco puff flavor but it didn't and it didn't even taste like coffee. the pastries were pretty dry and stale not sure how long they were out for. they also messed up our order but the service was okay, couldn't hear anything over the loud music. sad to say that i won't be coming back.","Aug 23, 2024"
The food and service is great! I love their chicken chipotle and turkey panini both are delish. The drinks are good too! My son loves the horchata frappe and the pepperoni panini.,"May 18, 2023"
"The drinks and food are really good. The staff is wonderful and welcoming. The place looks so pretty and clean. When i went, one of their employees, Luz took my order. Best customer service! She made me feel right at home and is very sweet! I recommend getting the Horchata Latte or if you want something refreshing try their lemonades.","Mar 13, 2024"
Right down the street from me! Really cute place with tasty drinks. I'd recommend the horchata frappe.,"Oct 24, 2022"
The service and ambiance are amazing! The cafe de olla with almond milk was delicious. I came on a Friday afternoon and lots of street parking.,"May 5, 2023"
"The cafecito was and the crepes service was friendly as well. Over all a chill place. It's on state which is a busy street so depending the time you go parking might be a bit rough, we went late night so it wasn't bad.","Feb 18, 2023"
Found this place by chance need a place to stop at while waiting for my car. I love little coffee shops. Got a basic latte and a nutella tropical crepe had to substitute the strawberries with mango and wow was that yummy. The employees are nice. Glad I stopped by.,"Dec 23, 2022"
"This place is so cute and cozy great ambiance. I love that every time I come in they welcome you with a smile super nice service. Their Cafe De olla is so good one of my favorites, i recently tried their holiday drinks they where so delicious . I was also a recently winner of their giveaway that's how you know I'm a frequently visitor of theirs. Plus let's support our local cafe shops stop going to Starbucks who support Genocide.","Dec 18, 2023"
"Super cute lil coffee shop on state street. There's only street parking and it shouldn't be too hard to find. The cashier was helpful and my drinks were good.
I got an iced caramel macchiato with oat milk and two extra shots of expresso.
An iced dirty chai with oat milk and I think it comes with one shot of expresso.
And a coffee cake that was fresh and tasty. Super cute spot to check out","Jan 12, 2023"
Coffee and Crepe was quick and delicioso! Very clean. Best coffee in the area. Parking in front.,"May 20, 2023"
"Cute ""hole in the wall"" Had the Cinnamon Latte, Abuelita Latte and Hazelnut Late. Best one was the Cinnamon Latte for me. Service is very nice, even though we came almost close to closing hours.","Jan 23, 2023"
"Disappointing to go over to the store earlier because of new hours posted on Instagram but it was closed. It has happened twice to me now. Save yourself from a drive, the new hours are not true.","Aug 31, 2023"
Amazing service very nice place to sit and eat the turkey panini is very good must try! Nice ambiance,"Feb 17, 2023"
Got the coco puffs iced coffee and that was the worst iced coffee I've ever had. I literally got brown colored water with cereal it did not taste like coffee at all and it was more expensive than Starbucks.,"Apr 14, 2023"
"The cafe de olla was good but I can't say the same for the ham and cheese croissant that I ordered, it actually gave me a stomach ache. It is a cute little coffee spot I'd definitely be back for the drinks. So happy there's cute little family owned places like this opening up in the area soo much better than Starbucks.","May 18, 2023"
this is the 4th time i've shown up when it says they're open but theyre not. update your hours.,"Jan 6, 2024"
Great service and food. Small and comfortable. Nice environment to just have a small break.,"Apr 29, 2023"
Place is small but nice. The cashier has a great attitude. The drinks are awesome and prices are fair. I have enjoyed their drinks on three separate occasions. Definitely recommend this place.,"Apr 26, 2023"
"Hi everyone, I'm Tanya, a college student who goes to CSULB. When going out with friends, I happen to go to an abundance of coffee shops and they are usually average. I appreciate them, but I usually wouldn't opt for them as my first choice. I'd been wanting to try out this coffee place since I heard about them on Instagram. I can honestly say, I wasn't disappointed by the service I got. I can feel that family vibe and it really feels like everything is made by love and passion. That's a big difference from the Starbucks down the street. The design of the place is also stellar. I really like what they've done with a place that maybe isn't too big, it's a nice, comfortable area to enjoy your drink and food of choice. I will say I came in the morning around 9am so there wasn't a ton of people, but I can see this place packed at later times in the day. I wish them the very best of luck in thriving as a small family owned shop!!","Nov 5, 2022"
"I was walking along and stumbled across this place. I thought the name was really cute so I decided to check it out. Turns out that they just opened yesterday! I was happy to support a new business and got the blended matcha latte which was really good, the perfect amount of sweetness. My friend got thrifty ice cream which was super cool to see at a coffee shop! Definitely recommend stopping by.","Oct 23, 2022"
"It's a surprisingly nice place, the service and food was good. I do wish there were items like ketchup or Jelly but seeing as they are just starting, pretty good start. Overall, it was a pretty good experience. I would recommend for a quick early morning breakfast and coffee.","Dec 13, 2022"
"Such a cute coffee shop with great coffee, specifically the cafe de olla. I'm so glad I stumbled upon this gem. They were very welcoming which made my experience there perfect","Nov 11, 2022"
Super cute place and everyone is super friendly and welcoming. They have a great selection of drinks and food items at equally great prices. Love the Cinnamon Toast Crunch iced coffee and the Cafe de Olla.,"Oct 30, 2022"
"I'm sorry I don't usually make reviews but I have to for this place. I understand you are a small business that just opened up but did not have a hanging menu. I had to hurry and pick what I wanted since others wanted to see the menu too. I then saw they had an online menu. Ordered a croissant from there. The croissant online stated it would have tomato and onion. When I got my croissant, it was just ham and cheese. I ate half a slice and when I got to the other half, it had a hair in it. a curly hair. I have straight hair so I know it wasn't mine. I tried to stay positive but then I found a hair stuck to the wrapper with cheese. I couldn't eat it anymore. Ever since then when I think of this place , I have a bad taste in my mouth. I also ordered a coco puff ice coffee. It tasted like leftover milk when you eat the coco puffs. They put coco puffs on top of your drink. They were stale. This was a very bad experience. I do not recommend this place. I rather buy a drink and a food item from Starbucks.","Dec 3, 2022"
